<compass-core-config xmlns="http://www.opensymphony.com/compass/schema/core-config"
	   xmlns:xsi="http://www.w3.org/2001/XMLSchema-instance"
	   xsi:schemaLocation="http://www.opensymphony.com/compass/schema/core-config http://www.opensymphony.com/compass/schema/compass-core-config.xsd">

    <compass name="default">

        <connection>
            <file path="target/testindex" />
        </connection>

        <transaction factory="org.compass.gps.device.hibernate.HibernateSyncTransactionFactory" />

        <mappings>
            <class name="org.compass.gps.device.hibernate.transaction.A" />
        </mappings>

        <settings>
            <setting name="compass.engine.optimizer.type" value="org.compass.core.lucene.engine.optimizer.NullOptimizer" />
        </settings>
    </compass>

</compass-core-config>
