<compass-core-config xmlns="http://www.opensymphony.com/compass/schema/core-config"
	   xmlns:xsi="http://www.w3.org/2001/XMLSchema-instance"
	   xsi:schemaLocation="http://www.opensymphony.com/compass/schema/core-config http://www.opensymphony.com/compass/schema/compass-core-config.xsd">

    <compass name="default">

        <connection>
            <jdbc dialect="org.apache.lucene.store.jdbc.dialect.HSQLDialect" managed="false">
                <dataSourceProvider>
                    <jndi lookup="testds" username="testusername" password="testpassword" />
                </dataSourceProvider>
                <ddl>
                    <nameColumn name="myname" length="70" />
                    <sizeColumn name="mysize" />
                </ddl>
            </jdbc>
        </connection>
    </compass>

</compass-core-config>
